<liga xmlns:xsi="http://www.w3.org/2001/XMLSchema-instance" nombre="laliga" xsi:noNamespaceSchemaLocation="ejermadrid.xsd">
    <arbitros>
        <arbitro>Melissa</arbitro>
        <arbitro>Aaron</arbitro>
        <arbitro>Salva</arbitro>
    </arbitros>
    <equipos>
        <equipo nombre="Real Madrid">
            <entrenador>Ancelotti</entrenador>
            <presidente>Tito Floren</presidente>
            <jugadores>
                <jugador>Bellingham</jugador>
                <jugador>Luka Modric</jugador>
                <jugador>Vallejo</jugador>
            </jugadores>
        </equipo>
        <equipo> </equipo>
    </equipos>
</liga>